id,name,short_description,main_image,images,description,price,stock,raiting,created_at,shop_id,shop_slug,shop_name,shop_description,shop_background_image,shop_address,shop_contact,shop_rating,shop_timezone,shop_created_at
1,Gorgeous Steel Soap,Sit dolores temporibus esse beatae.,http://placeimg.com/640/480/technics,"{""http://placeimg.com/640/480/transport"",""http://placeimg.com/640/480/nature"",""http://placeimg.com/640/480/transport""}","The automobile layout consists of a front-engine design, with transaxle-type transmissions mounted at the rear of the engine and four wheel drive",10028,67542,4,Fri Sep 17 2021 15:51:56 GMT+0200 (Central European Summer Time),1,sipes-wyman-and-davis,"Sipes, Wyman and Davis",Ab quas aut. Assumenda hic consequatur illo omnis in enim sed aperiam.,http://placeimg.com/640/480/animals,81965 Lowe Passage,575-941-2551 x64807,2,Etc/UTC,Wed Apr 28 2021 21:16:43 GMT+0200 (Central European Summer Time)
2,Tasty Soft Table,Quia rerum corporis.,http://placeimg.com/640/480/cats,"{""http://placeimg.com/640/480/technics"",""http://placeimg.com/640/480/nightlife"",""http://placeimg.com/640/480/city""}",Carbonite web goalkeeper gloves are ergonomically designed to give easy fit,13750,73096,0,Tue Jul 27 2021 14:53:43 GMT+0200 (Central European Summer Time),1,mitchell-schneider-and-gerlach,"Mitchell, Schneider and Gerlach",Laboriosam reprehenderit itaque ut qui ut sed voluptatem vel. Quam iure quisquam et inventore est aspernatur rerum qui.,http://placeimg.com/640/480/abstract,28674 Reynolds Stream,509.440.9422 x9300,2,Asia/Jakarta,Mon Aug 02 2021 07:02:17 GMT+0200 (Central European Summer Time)
3,Refined Soft Mouse,Impedit accusamus magni dolor architecto eum aut saepe non.,http://placeimg.com/640/480/business,"{""http://placeimg.com/640/480/sports"",""http://placeimg.com/640/480/cats"",""http://placeimg.com/640/480/business""}","Andy shoes are designed to keeping in mind durability as well as trends, the most stylish range of shoes & sandals",44347,1637,6,Wed Aug 18 2021 08:16:48 GMT+0200 (Central European Summer Time),1,kautzer-and-sons,Kautzer and Sons,Et harum nesciunt ea fuga dignissimos soluta. Iusto ipsam possimus nemo officiis voluptate.,http://placeimg.com/640/480/fashion,4949 Domenic Club,1-872-204-9601 x12122,2,Europe/Vilnius,Thu Sep 02 2021 12:34:05 GMT+0200 (Central European Summer Time)
4,Ergonomic Soft Towels,Provident odit aspernatur non.,http://placeimg.com/640/480/nightlife,"{""http://placeimg.com/640/480/nightlife"",""http://placeimg.com/640/480/food"",""http://placeimg.com/640/480/transport""}","The Nagasaki Lander is the trademarked name of several series of Nagasaki sport bikes, that started with the 1984 ABC800J",64313,64229,0,Thu Jan 28 2021 06:44:35 GMT+0100 (Central European Standard Time),2,hirthe-wolf,Hirthe - Wolf,Consequatur a cum. Nostrum impedit ut sed cumque quidem.,http://placeimg.com/640/480/people,225 Elvie Grove,1-851-449-4731 x041,2,America/Regina,Wed Jan 27 2021 10:09:47 GMT+0100 (Central European Standard Time)
5,Ergonomic Concrete Hat,Est possimus voluptatem reprehenderit inventore.,http://placeimg.com/640/480/cats,"{""http://placeimg.com/640/480/nature"",""http://placeimg.com/640/480/business"",""http://placeimg.com/640/480/fashion""}",Carbonite web goalkeeper gloves are ergonomically designed to give easy fit,241,37473,4,Wed Dec 16 2020 21:44:39 GMT+0100 (Central European Standard Time),2,bosco-carroll,Bosco - Carroll,Qui provident magni officia voluptatem quasi et autem consequatur error. Sed minus fuga harum.,http://placeimg.com/640/480/nightlife,54845 Kirlin Curve,1-579-659-8194 x351,6,Asia/Kabul,Thu Apr 08 2021 10:06:08 GMT+0200 (Central European Summer Time)
6,Licensed Steel Cheese,Amet quo ut illo.,http://placeimg.com/640/480/abstract,"{""http://placeimg.com/640/480/fashion"",""http://placeimg.com/640/480/transport"",""http://placeimg.com/640/480/technics""}","New ABC 13 9370, 13.3, 5th Gen CoreA5-8250U, 8GB RAM, 256GB SSD, power UHD Graphics, OS 10 Home, OS Office A & J 2016",74744,78738,0,Sat Jun 26 2021 04:11:32 GMT+0200 (Central European Summer Time),2,hettinger-group,Hettinger Group,Nostrum quisquam repellat autem perferendis aut nisi dicta modi dignissimos. Vel accusamus eum sapiente nostrum.,http://placeimg.com/640/480/sports,76152 Cara Corner,(864) 882-3498,2,Pacific/Auckland,Sun May 23 2021 07:40:25 GMT+0200 (Central European Summer Time)
7,Licensed Rubber Computer,Dolor eum optio culpa aperiam.,http://placeimg.com/640/480/people,"{""http://placeimg.com/640/480/abstract"",""http://placeimg.com/640/480/fashion"",""http://placeimg.com/640/480/fashion""}","New ABC 13 9370, 13.3, 5th Gen CoreA5-8250U, 8GB RAM, 256GB SSD, power UHD Graphics, OS 10 Home, OS Office A & J 2016",49109,73525,4,Wed Feb 10 2021 11:44:51 GMT+0100 (Central European Standard Time),3,ferry-davis-and-price,"Ferry, Davis and Price",Mollitia sequi officia qui cumque. Veniam pariatur nostrum illo nisi est est.,http://placeimg.com/640/480/city,716 Fadel Drive,519.229.0142,2,Asia/Muscat,Wed Dec 16 2020 10:40:49 GMT+0100 (Central European Standard Time)
8,Awesome Rubber Bacon,Dolor quo ducimus cum dolores unde eos dolores cum.,http://placeimg.com/640/480/technics,"{""http://placeimg.com/640/480/food"",""http://placeimg.com/640/480/food"",""http://placeimg.com/640/480/food""}","The automobile layout consists of a front-engine design, with transaxle-type transmissions mounted at the rear of the engine and four wheel drive",8326,65491,2,Wed Dec 30 2020 02:48:04 GMT+0100 (Central European Standard Time),3,raynor-nikolaus,Raynor - Nikolaus,Eligendi id et omnis explicabo dolorem iste sint eos. Qui eos nemo et ullam rem.,http://placeimg.com/640/480/cats,099 Hyatt Turnpike,1-454-568-5141 x3883,4,Europe/Copenhagen,Sun Sep 05 2021 21:32:05 GMT+0200 (Central European Summer Time)
9,Intelligent Steel Sausages,Pariatur quo fugit.,http://placeimg.com/640/480/nightlife,"{""http://placeimg.com/640/480/animals"",""http://placeimg.com/640/480/animals"",""http://placeimg.com/640/480/technics""}","Boston's most advanced compression wear technology increases muscle oxygenation, stabilizes active muscles",79266,96477,0,Sun Oct 17 2021 01:07:11 GMT+0200 (Central European Summer Time),3,oberbrunner-and-sons,Oberbrunner and Sons,Nesciunt a temporibus voluptates quisquam molestias et. Natus est blanditiis vel vel ipsa eum aliquid culpa itaque.,http://placeimg.com/640/480/nightlife,91426 Brionna Forks,672-234-6095,4,America/Argentina/Buenos_Aires,Fri Apr 09 2021 15:45:41 GMT+0200 (Central European Summer Time)
10,Handcrafted Granite Chair,Recusandae et veniam expedita nobis.,http://placeimg.com/640/480/fashion,"{""http://placeimg.com/640/480/transport"",""http://placeimg.com/640/480/abstract"",""http://placeimg.com/640/480/abstract""}","New ABC 13 9370, 13.3, 5th Gen CoreA5-8250U, 8GB RAM, 256GB SSD, power UHD Graphics, OS 10 Home, OS Office A & J 2016",19608,12846,0,Thu Apr 22 2021 08:41:50 GMT+0200 (Central European Summer Time),4,morissette-wilderman,Morissette - Wilderman,Omnis ducimus est. Modi nesciunt rerum sapiente iste voluptates.,http://placeimg.com/640/480/business,786 Lakin Manor,532-628-1710 x8212,4,Asia/Tokyo,Fri Jul 30 2021 00:38:51 GMT+0200 (Central European Summer Time)