id,name,short_description,main_image,images,description,price,stock,raiting,created_at,shop_id,shop_slug,shop_name,shop_description,shop_background_image,shop_address,shop_contact,shop_rating,shop_timezone,shop_created_at
2,Licensed Wooden Ball,Et recusandae velit.,http://placeimg.com/640/480/transport,"{""http://placeimg.com/640/480/cats"",""http://placeimg.com/640/480/cats"",""http://placeimg.com/640/480/abstract""}",Ergonomic executive chair upholstered in bonded black leather and PVC padded seat and back for all-day comfort and support,57498,6850,6,Mon Sep 20 2021 02:21:14 GMT+0200 (Central European Summer Time),1,treutel-hoeger-and-legros,"Treutel, Hoeger and Legros",Consectetur veritatis in consectetur cum maiores repellendus quos enim. Nobis eos quidem veniam neque harum omnis architecto.,http://placeimg.com/640/480/city,1144 Dooley Mission,(228) 814-3346,2,Asia/Vladivostok,Wed Dec 01 2021 23:46:56 GMT+0100 (Central European Standard Time)
3,Small Granite Gloves,Neque dignissimos quia ipsam impedit quas.,http://placeimg.com/640/480/fashion,"{""http://placeimg.com/640/480/fashion"",""http://placeimg.com/640/480/technics"",""http://placeimg.com/640/480/fashion""}",Carbonite web goalkeeper gloves are ergonomically designed to give easy fit,1486,11023,2,Fri Jun 25 2021 00:06:47 GMT+0200 (Central European Summer Time),1,bogisich-inc,Bogisich Inc,Voluptatem rerum optio aut accusantium id eum. Quam incidunt qui.,http://placeimg.com/640/480/transport,29598 Kertzmann Pines,462.612.6562 x71188,2,Asia/Novosibirsk,Sat Oct 23 2021 02:33:41 GMT+0200 (Central European Summer Time)
4,Practical Metal Shoes,Tempora est quia blanditiis rerum ab temporibus consectetur minus.,http://placeimg.com/640/480/sports,"{""http://placeimg.com/640/480/technics"",""http://placeimg.com/640/480/nightlife"",""http://placeimg.com/640/480/nightlife""}","The Nagasaki Lander is the trademarked name of several series of Nagasaki sport bikes, that started with the 1984 ABC800J",26108,37266,2,Wed Oct 06 2021 01:54:27 GMT+0200 (Central European Summer Time),3,borer-group,Borer Group,Qui tempora saepe voluptatem sed non nihil. Et explicabo voluptas quod.,http://placeimg.com/640/480/sports,9615 Marjolaine Turnpike,673.381.5211 x9992,2,Europe/Bucharest,Fri Jun 25 2021 23:29:40 GMT+0200 (Central European Summer Time)
5,Fantastic Concrete Salad,Totam sapiente doloribus iusto exercitationem.,http://placeimg.com/640/480/sports,"{""http://placeimg.com/640/480/cats"",""http://placeimg.com/640/480/city"",""http://placeimg.com/640/480/people""}",Carbonite web goalkeeper gloves are ergonomically designed to give easy fit,99967,95184,4,Mon Oct 18 2021 09:30:54 GMT+0200 (Central European Summer Time),3,greenfelder-group,Greenfelder Group,Error sint est totam autem quia incidunt sint et. Quidem nihil neque laborum est id provident facere minima qui.,http://placeimg.com/640/480/nature,3674 Kutch Ports,969.836.2679 x8392,2,America/Godthab,Tue Apr 27 2021 08:49:27 GMT+0200 (Central European Summer Time)
7,Ergonomic Metal Chair,Culpa aut vero voluptatum quo.,http://placeimg.com/640/480/transport,"{""http://placeimg.com/640/480/abstract"",""http://placeimg.com/640/480/business"",""http://placeimg.com/640/480/abstract""}",The slim & simple Maple Gaming Keyboard from Dev Byte comes with a sleek body and 7- Color RGB LED Back-lighting for smart functionality,84642,47289,0,Thu Feb 18 2021 01:24:30 GMT+0100 (Central European Standard Time),2,gerlach-llc,Gerlach LLC,Vel velit quisquam in deleniti sed ipsa sunt libero. Vitae explicabo itaque facere eos.,http://placeimg.com/640/480/fashion,1964 Keven Greens,(727) 454-6982,0,Europe/Budapest,Thu Sep 30 2021 15:42:31 GMT+0200 (Central European Summer Time)
6,Sleek Steel Chicken,Fugit quis illum velit rerum natus voluptatem voluptatem vero debitis.,http://placeimg.com/640/480/nightlife,"{""http://placeimg.com/640/480/food"",""http://placeimg.com/640/480/technics"",""http://placeimg.com/640/480/business""}",The beautiful range of Apple Naturalé that has an exciting mix of natural ingredients. With the Goodness of 100% Natural Ingredients,82172,79376,2,Sun Oct 24 2021 12:21:50 GMT+0200 (Central European Summer Time),3,lockman-and-sons,Lockman and Sons,Ut rerum quod voluptas odit libero ducimus et commodi dolores. Nemo alias sapiente qui quia molestiae rerum soluta.,http://placeimg.com/640/480/transport,7867 Pfeffer Motorway,456-900-2893 x894,6,Europe/Berlin,Tue Feb 23 2021 21:37:43 GMT+0100 (Central European Standard Time)
8,Generic Frozen Computer,Nulla omnis quas.,http://placeimg.com/640/480/nightlife,"{""http://placeimg.com/640/480/city"",""http://placeimg.com/640/480/fashion"",""http://placeimg.com/640/480/food""}","Andy shoes are designed to keeping in mind durability as well as trends, the most stylish range of shoes & sandals",43088,55834,2,Mon Jan 25 2021 11:12:39 GMT+0100 (Central European Standard Time),2,becker-haag,Becker - Haag,Est veniam recusandae. Voluptates delectus totam ut voluptate labore.,http://placeimg.com/640/480/cats,44315 Dietrich Prairie,430.654.0300,0,Europe/Lisbon,Sun Jan 17 2021 17:49:17 GMT+0100 (Central European Standard Time)
9,Fantastic Plastic Soap,Repellat aut assumenda quibusdam cupiditate ut.,http://placeimg.com/640/480/business,"{""http://placeimg.com/640/480/food"",""http://placeimg.com/640/480/nightlife"",""http://placeimg.com/640/480/technics""}",The beautiful range of Apple Naturalé that has an exciting mix of natural ingredients. With the Goodness of 100% Natural Ingredients,61797,3909,4,Tue Nov 16 2021 02:11:45 GMT+0100 (Central European Standard Time),4,cormier-mclaughlin,Cormier - McLaughlin,Adipisci aut voluptatem fugiat et. Quis et corporis iusto voluptas aut sequi dicta eveniet.,http://placeimg.com/640/480/nightlife,5346 Durgan Spur,621-444-3341 x76800,2,Pacific/Midway,Sun Apr 11 2021 11:46:42 GMT+0200 (Central European Summer Time)
10,Handcrafted Steel Computer,Vitae aperiam id labore.,http://placeimg.com/640/480/city,"{""http://placeimg.com/640/480/sports"",""http://placeimg.com/640/480/people"",""http://placeimg.com/640/480/nightlife""}",Ergonomic executive chair upholstered in bonded black leather and PVC padded seat and back for all-day comfort and support,24683,12619,0,Sun Oct 17 2021 13:46:09 GMT+0200 (Central European Summer Time),2,morar-conn-and-o'hara,"Morar, Conn and O'Hara",Saepe voluptas ratione minus non. Qui et quasi quos facilis sit suscipit a.,http://placeimg.com/640/480/food,856 Blick Villages,(773) 655-9072 x8044,0,Europe/Moscow,Wed Apr 28 2021 16:10:24 GMT+0200 (Central European Summer Time)